{
  "$schema": "http://json-schema.org/draft-07/schema#",
  "title": "AlgorithmicThought",
  "type": "object",
  "required": ["mode", "thoughtType", "dependencies", "assumptions", "uncertainty"],
  "properties": {
    "mode": { "const": "algorithmic" },
    "thoughtType": {
      "type": "string",
      "enum": [
        "algorithm_definition",
        "algorithm_selection",
        "complexity_analysis",
        "recurrence_solving",
        "correctness_proof",
        "data_structure_selection",
        "comparison"
      ]
    },
    "algorithm": {
      "type": "object",
      "required": ["id", "name", "description", "category", "designPattern", "input", "output"],
      "properties": {
        "id": { "type": "string" },
        "name": { "type": "string" },
        "description": { "type": "string" },
        "category": { "type": "string" },
        "designPattern": {
          "type": "string",
          "enum": ["divide_and_conquer", "dynamic_programming", "greedy", "graph_traversal", "branch_and_bound", "backtracking", "randomized", "brute_force", "transform_and_conquer"]
        },
        "input": {
          "type": "object",
          "required": ["description", "constraints", "dataStructure"],
          "properties": {
            "description": { "type": "string" },
            "constraints": { "type": "array", "items": { "type": "string" } },
            "dataStructure": { "type": "string" }
          },
          "additionalProperties": false
        },
        "output": {
          "type": "object",
          "required": ["description", "properties"],
          "properties": {
            "description": { "type": "string" },
            "properties": { "type": "array", "items": { "type": "string" } }
          },
          "additionalProperties": false
        },
        "pseudocode": { "type": "string" },
        "timeComplexity": {
          "type": "object",
          "properties": {
            "bestCase": { "type": "string" },
            "averageCase": { "type": "string" },
            "worstCase": { "type": "string" },
            "recurrence": { "type": "string" }
          },
          "additionalProperties": false
        },
        "spaceComplexity": {
          "type": "object",
          "properties": {
            "auxiliary": { "type": "string" },
            "total": { "type": "string" },
            "inPlace": { "type": "boolean" }
          },
          "additionalProperties": false
        },
        "practical": {
          "type": "object",
          "properties": {
            "cacheEfficient": { "type": "boolean" },
            "parallelizable": { "type": "boolean" },
            "stable": { "type": "boolean" },
            "deterministic": { "type": "boolean" }
          },
          "additionalProperties": false
        },
        "clrsReference": {
          "type": "object",
          "properties": {
            "chapter": { "type": "integer" },
            "section": { "type": "number" }
          },
          "additionalProperties": false
        }
      },
      "additionalProperties": false
    },
    "clrsCategory": { "type": "string" },
    "clrsAlgorithm": { "type": "string" },
    "designPattern": {
      "type": "string",
      "enum": ["divide_and_conquer", "dynamic_programming", "greedy", "graph_traversal", "branch_and_bound", "backtracking", "randomized", "brute_force", "transform_and_conquer"]
    },
    "timeComplexity": {
      "type": "object",
      "required": ["bestCase", "averageCase", "worstCase"],
      "properties": {
        "bestCase": { "type": "string" },
        "averageCase": { "type": "string" },
        "worstCase": { "type": "string" },
        "amortized": { "type": ["string", "null"] },
        "recurrence": { "type": "string" },
        "closedForm": { "type": "string" },
        "masterTheorem": {
          "type": "object",
          "required": ["a", "b", "f", "case"],
          "properties": {
            "a": { "type": "integer", "minimum": 1 },
            "b": { "type": "integer", "minimum": 2 },
            "f": { "type": "string" },
            "case": { "type": "integer", "enum": [1, 2, 3] }
          },
          "additionalProperties": false
        }
      },
      "additionalProperties": false
    },
    "spaceComplexity": {
      "type": "object",
      "required": ["auxiliary", "total", "inPlace"],
      "properties": {
        "auxiliary": { "type": "string" },
        "total": { "type": "string" },
        "inPlace": { "type": "boolean" },
        "stackDepth": { "type": "string" },
        "cacheEfficiency": {
          "type": "object",
          "required": ["cacheOblivious"],
          "properties": {
            "cacheOblivious": { "type": "boolean" },
            "cacheComplexity": { "type": "string" }
          },
          "additionalProperties": false
        }
      },
      "additionalProperties": false
    },
    "recurrence": {
      "type": "object",
      "required": ["id", "formula", "baseCase", "solutionMethod", "solution"],
      "properties": {
        "id": { "type": "string" },
        "formula": { "type": "string" },
        "baseCase": { "type": "string" },
        "solutionMethod": {
          "type": "string",
          "enum": ["master_theorem", "substitution", "recursion_tree", "generating_function"]
        },
        "solution": { "type": "string" },
        "solutionProof": { "type": "string" },
        "recursionTree": {
          "type": "object",
          "required": ["levelWork", "levels", "totalWork"],
          "properties": {
            "levelWork": { "type": "string" },
            "levels": { "type": "string" },
            "totalWork": { "type": "string" }
          },
          "additionalProperties": false
        }
      },
      "additionalProperties": false
    },
    "correctnessProof": {
      "type": "object",
      "required": ["id", "algorithm", "method", "preconditions", "postconditions", "terminationArgument"],
      "properties": {
        "id": { "type": "string" },
        "algorithm": { "type": "string" },
        "method": {
          "type": "string",
          "enum": ["loop_invariant", "induction", "contradiction", "direct", "structural"]
        },
        "preconditions": { "type": "array", "items": { "type": "string" } },
        "postconditions": { "type": "array", "items": { "type": "string" } },
        "invariants": {
          "type": "array",
          "items": {
            "type": "object",
            "required": ["id", "description", "initialization", "maintenance", "termination"],
            "properties": {
              "id": { "type": "string" },
              "description": { "type": "string" },
              "initialization": {
                "type": "object",
                "required": ["statement", "proof"],
                "properties": {
                  "statement": { "type": "string" },
                  "proof": { "type": "string" }
                },
                "additionalProperties": false
              },
              "maintenance": {
                "type": "object",
                "required": ["statement", "proof"],
                "properties": {
                  "statement": { "type": "string" },
                  "proof": { "type": "string" }
                },
                "additionalProperties": false
              },
              "termination": {
                "type": "object",
                "required": ["statement", "proof"],
                "properties": {
                  "statement": { "type": "string" },
                  "proof": { "type": "string" }
                },
                "additionalProperties": false
              }
            },
            "additionalProperties": false
          }
        },
        "inductionBase": { "type": "string" },
        "inductionStep": { "type": "string" },
        "terminationArgument": {
          "type": "object",
          "required": ["decreasingQuantity", "lowerBound", "proof"],
          "properties": {
            "decreasingQuantity": { "type": "string" },
            "lowerBound": { "type": "string" },
            "proof": { "type": "string" }
          },
          "additionalProperties": false
        }
      },
      "additionalProperties": false
    },
    "dpFormulation": {
      "type": "object",
      "required": ["id", "problem", "characterization"],
      "properties": {
        "id": { "type": "string" },
        "problem": { "type": "string" },
        "characterization": {
          "type": "object",
          "required": ["optimalSubstructure", "subproblemDefinition"],
          "properties": {
            "optimalSubstructure": { "type": "string" },
            "subproblemDefinition": { "type": "string" }
          },
          "additionalProperties": false
        },
        "recurrenceRelation": { "type": "string" },
        "baseCase": { "type": "string" },
        "computationOrder": { "type": "string" },
        "memoization": { "type": "string" }
      },
      "additionalProperties": false
    },
    "greedyProof": {
      "type": "object",
      "required": ["id", "problem", "greedyChoice"],
      "properties": {
        "id": { "type": "string" },
        "problem": { "type": "string" },
        "greedyChoice": {
          "type": "object",
          "required": ["description", "localOptimum", "globalOptimumProof"],
          "properties": {
            "description": { "type": "string" },
            "localOptimum": { "type": "string" },
            "globalOptimumProof": { "type": "string" }
          },
          "additionalProperties": false
        },
        "optimalSubstructure": { "type": "string" }
      },
      "additionalProperties": false
    },
    "dataStructure": {
      "type": "object",
      "required": ["name", "description", "operations"],
      "properties": {
        "name": { "type": "string" },
        "description": { "type": "string" },
        "operations": {
          "type": "array",
          "items": {
            "type": "object",
            "required": ["name", "complexity", "description"],
            "properties": {
              "name": { "type": "string" },
              "complexity": { "type": "string" },
              "description": { "type": "string" }
            },
            "additionalProperties": false
          }
        }
      },
      "additionalProperties": false
    },
    "amortizedAnalysis": {
      "type": "object",
      "required": ["method", "conclusion"],
      "properties": {
        "method": { "type": "string", "enum": ["aggregate", "accounting", "potential"] },
        "conclusion": { "type": "string" },
        "amortizedCost": { "type": "string" },
        "potentialFunction": { "type": "string" }
      },
      "additionalProperties": false
    },
    "comparison": {
      "type": "object",
      "required": ["alternatives", "winner", "justification"],
      "properties": {
        "alternatives": {
          "type": "array",
          "items": {
            "type": "object",
            "required": ["name", "timeComplexity", "spaceComplexity", "reason"],
            "properties": {
              "name": { "type": "string" },
              "timeComplexity": { "type": "string" },
              "spaceComplexity": { "type": "string" },
              "reason": { "type": "string" }
            },
            "additionalProperties": false
          }
        },
        "winner": { "type": "string" },
        "justification": { "type": "string" }
      },
      "additionalProperties": false
    },
    "loopInvariants": {
      "type": "array",
      "items": {
        "type": "object",
        "required": ["id", "description", "initialization", "maintenance", "termination"],
        "properties": {
          "id": { "type": "string" },
          "description": { "type": "string" },
          "initialization": {
            "type": "object",
            "required": ["statement", "proof"],
            "properties": {
              "statement": { "type": "string" },
              "proof": { "type": "string" }
            },
            "additionalProperties": false
          },
          "maintenance": {
            "type": "object",
            "required": ["statement", "proof"],
            "properties": {
              "statement": { "type": "string" },
              "proof": { "type": "string" }
            },
            "additionalProperties": false
          },
          "termination": {
            "type": "object",
            "required": ["statement", "proof"],
            "properties": {
              "statement": { "type": "string" },
              "proof": { "type": "string" }
            },
            "additionalProperties": false
          }
        },
        "additionalProperties": false
      }
    },
    "pseudocode": { "type": "string" },
    "keyInsight": { "type": "string" },
    "dependencies": {
      "type": "array",
      "items": { "type": "string" }
    },
    "assumptions": {
      "type": "array",
      "items": { "type": "string" }
    },
    "uncertainty": {
      "type": "number",
      "minimum": 0,
      "maximum": 1
    }
  },
  "additionalProperties": false
}
